{
 "schema_version": "0.1.0",
 "package_id": "MRP-TRY-751124-try",
 "utterance_ref": {
  "utterance_id": "TRY-751124",
  "input_sha256": "9cdd9befc9599b420980e36be7b369f7a5768d32609d3edeee75852ab01250ef"
 },
 "status": "awaiting_review",
 "provenance": {
  "pipeline": "farajamh-minority-report",
  "pipeline_version": "0.2.0-pilot",
  "upstream": "https://github.com/codata/the-minority-report @ a7cb9cbf90cffb186c69699b5a188f970d22e5b9",
  "run_id": "try",
  "started_at": "2026-09-23T12:22:35+00:00",
  "ended_at": "2026-09-23T12:24:44+00:00",
  "backend_mode": "live",
  "models": [
   {
    "model_ref": "gemma3:12b",
    "family": "gemma",
    "role": "normaliser",
    "digest": "f4031aab637d1ffa37b42570452ae0e4fad0314754d17ded67322e4b95836f8a",
    "host_locality": "local_dsa_approved",
    "options": {
     "temperature": 0.2,
     "seed": 42
    }
   },
   {
    "model_ref": "gemma3:12b",
    "family": "gemma",
    "role": "translator+interpreter+ranker",
    "digest": "f4031aab637d1ffa37b42570452ae0e4fad0314754d17ded67322e4b95836f8a",
    "host_locality": "local_dsa_approved",
    "options": {
     "temperature": 0.2,
     "seed": 42
    }
   },
   {
    "model_ref": "qwen2.5:7b",
    "family": "qwen",
    "role": "translator+interpreter+ranker",
    "digest": "845dbda0ea48ed749caafd9e6037047aa19acfcfd82e704d7ca97d631a0b697e",
    "host_locality": "local_dsa_approved",
    "options": {
     "temperature": 0.2,
     "seed": 42
    }
   },
   {
    "model_ref": "llama3.1:8b",
    "family": "llama",
    "role": "translator+interpreter+ranker",
    "digest": "46e0c10c039e019119339687c3c1757cc81b9da49709a3b3924863ba87ca666e",
    "host_locality": "local_dsa_approved",
    "options": {
     "temperature": 0.2,
     "seed": 42
    }
   }
  ],
  "prompts": [
   {
    "name": "normalise",
    "sha256": "125e32f402d0ad2da346e519bb4d80e226d9d9a10c0eab20e3bd11985fd213fc"
   },
   {
    "name": "translate",
    "sha256": "3778d3a3877f70de5781db7f6d15044222b904d7be938003a014798ffece26dd"
   },
   {
    "name": "back_translate",
    "sha256": "a8b7049c7eaf02c95ec151acad85449e0b163413ff4a5f631feb5ebc9c1bea3d"
   },
   {
    "name": "interpret",
    "sha256": "afe1f067c37919e66133eeb0fa50ef7c7a49971140c031c7b025b9c438aa136e"
   },
   {
    "name": "rank_concepts",
    "sha256": "7b84e42553a0b2f44f3c7bef35479844d3c6422c63e3862f30555179ee48b09e"
   }
  ],
  "terminologies": [
   {
    "system": "MFOEM",
    "version": "<pin release>",
    "endpoint": "https://www.ebi.ac.uk/ols4/api"
   }
  ],
  "terminology_errors": [
   {
    "system": "MFOEM",
    "query": "sadness",
    "error": "URLError: <urlopen error [Errno 8] nodename nor servname provided, or not known>"
   },
   {
    "system": "MFOEM",
    "query": "The speaker is experiencing a profound sense of sadness or grief.",
    "error": "URLError: <urlopen error [Errno 8] nodename nor servname provided, or not known>"
   },
   {
    "system": "MFOEM",
    "query": "heartbreak",
    "error": "URLError: <urlopen error [Errno 8] nodename nor servname provided, or not known>"
   },
   {
    "system": "MFOEM",
    "query": "Experiencing a deep emotional pain, often related to a loss or betrayal.",
    "error": "URLError: <urlopen error [Errno 8] nodename nor servname provided, or not known>"
   }
  ],
  "policy": "policy/farajamh_mr_odrl.jsonld"
 },
 "L1_original": {
  "original_text": "Na Kwazika kiroho",
  "expression_span": {
   "start": 0,
   "end": 17,
   "text": "Na Kwazika kiroho"
  },
  "context_as_received": {
   "country": "KE",
   "region": "KE-nairobi",
   "site_id": "adhoc",
   "dialect_declared": "standard",
   "speaker_role": "participant",
   "setting": "chat_platform",
   "negation": {
    "value": "affirmed",
    "source": "annotator"
   },
   "temporality": {
    "value": "current",
    "source": "annotator"
   },
   "attribution": {
    "value": "self",
    "source": "annotator"
   }
  }
 },
 "L2_normalisation": {
  "normalised_text": "Na kuzika roho",
  "normalised_expression": "Na kuzika roho",
  "edits": [
   {
    "from": "Kwazika",
    "to": "kuzika",
    "type": "orthographic",
    "note": "Corrected spelling of verb 'to bury'"
   },
   {
    "from": "kiroho",
    "to": "roho",
    "type": "orthographic",
    "note": "Corrected spelling of 'soul'"
   }
  ],
  "language_id": "sw",
  "code_switch_segments": [],
  "dialect_hypotheses": [],
  "producer": "gemma3:12b"
 },
 "L3_translation": {
  "candidates": [
   {
    "candidate_id": "T1",
    "model_ref": "gemma3:12b",
    "literal_gloss": "And to bury spirit",
    "idiomatic_translation": "I feel like I'm burying a part of myself.",
    "preserved_terms": [
     {
      "term": "roho",
      "reason": "‘Roho’ refers to the spirit, soul, or inner self. It’s more profound than just ‘spirit’ in a religious sense; it encompasses one's vitality and sense of being. Burying it suggests a suppression or loss of that inner essence, a feeling of being diminished or extinguished."
     }
    ],
    "uncertainty_note": "The phrase 'kuzika' literally means 'to bury'. While the idiomatic translation captures the feeling of suppression or loss, the depth of the 'roho' concept might require further context to fully understand the speaker's experience. It's not necessarily indicative of a specific mental health condition, but rather a strong feeling of emotional distress.",
    "self_reported_confidence": 0.85,
    "back_translation": {
     "by_model": "qwen2.5:7b",
     "text": "Nipo kwamba nini nipo kufanya kifuniko ya kusimamia chini ya mimi.",
     "similarity_to_normalised": 0.0
    }
   },
   {
    "candidate_id": "T2",
    "model_ref": "qwen2.5:7b",
    "literal_gloss": "And my heart is heavy",
    "idiomatic_translation": "And I am feeling down",
    "preserved_terms": [
     {
      "term": "roho",
      "reason": "This term is culturally specific and refers to one's emotional state."
     }
    ],
    "uncertainty_note": "uncertain",
    "self_reported_confidence": 0.8,
    "back_translation": {
     "by_model": "llama3.1:8b",
     "text": "Ninakumbuka kuwa nina uwezo mdogo",
     "similarity_to_normalised": 0.0
    }
   },
   {
    "candidate_id": "T3",
    "model_ref": "llama3.1:8b",
    "literal_gloss": "With my heart being broken",
    "idiomatic_translation": "My heart is shattered",
    "preserved_terms": [
     {
      "term": "roho",
      "reason": "refers to the emotional or spiritual aspect of a person, not just the physical heart"
     }
    ],
    "uncertainty_note": "",
    "self_reported_confidence": 0.9,
    "back_translation": {
     "by_model": "gemma3:12b",
     "text": "Moyo wangu umevunjika.",
     "similarity_to_normalised": 0.0
    }
   }
  ]
 },
 "L4_interpretation": {
  "candidates": [
   {
    "sense_id": "S1",
    "model_ref": "gemma3:12b",
    "sense_key": "sadness",
    "gloss": "The speaker is experiencing a profound sense of sadness or grief.",
    "category": "emotional_state",
    "register": "everyday_cultural",
    "context_dependencies": [
     "lack of other emotional cues"
    ],
    "rationale": "The phrase 'kuzika roho' (burying a soul/heart) is often used metaphorically to express deep sorrow or loss, aligning with the translation 'I feel like I'm burying a part of myself' and 'My heart is shattered'.",
    "evidence": [
     {
      "type": "translation_candidate",
      "ref": "translation_candidate_1",
      "quote": "I feel like I'm burying a part of myself."
     }
    ],
    "self_reported_plausibility": 0.8
   },
   {
    "sense_id": "S2",
    "model_ref": "qwen2.5:7b",
    "sense_key": "sadness",
    "gloss": "I am feeling down.",
    "category": "emotional_state",
    "register": "everyday_cultural",
    "context_dependencies": [
     "negation=affirmed",
     "temporality=current",
     "attribution=self"
    ],
    "rationale": "The speaker is affirming a negative emotional state, and the phrase 'kuzika roho' is commonly used to express sadness or feeling down in Swahili.",
    "evidence": [
     {
      "type": "translation_candidate",
      "ref": "And I am feeling down",
      "quote": "And I am feeling down"
     }
    ],
    "self_reported_plausibility": 0.9
   },
   {
    "sense_id": "S3",
    "model_ref": "llama3.1:8b",
    "sense_key": "sadness",
    "gloss": "Feeling deeply sad or sorrowful.",
    "category": "emotional_state",
    "register": "everyday_cultural",
    "context_dependencies": [
     "negation=affirmed"
    ],
    "rationale": "The speaker is affirming the statement, which suggests a strong emotional state.",
    "evidence": [
     {
      "type": "utterance_span",
      "ref": "Na kuzika roho",
      "quote": "Na kuzika roho"
     }
    ],
    "self_reported_plausibility": 0.8
   },
   {
    "sense_id": "S4",
    "model_ref": "llama3.1:8b",
    "sense_key": "heartbreak",
    "gloss": "Experiencing a deep emotional pain, often related to a loss or betrayal.",
    "category": "emotional_state",
    "register": "everyday_cultural",
    "context_dependencies": [
     "negation=affirmed"
    ],
    "rationale": "The translation 'My heart is shattered' suggests a strong emotional pain.",
    "evidence": [
     {
      "type": "translation_candidate",
      "ref": "My heart is shattered",
      "quote": "My heart is shattered"
     }
    ],
    "self_reported_plausibility": 0.6
   }
  ]
 },
 "L5_agreement": {
  "n_models": 3,
  "model_families": [
   "gemma",
   "llama",
   "qwen"
  ],
  "sense_clusters": [
   {
    "cluster_id": "C1",
    "label": "sadness",
    "category": "emotional_state",
    "member_sense_ids": [
     "S1",
     "S2",
     "S3"
    ],
    "supporting_models": [
     "gemma3:12b",
     "qwen2.5:7b",
     "llama3.1:8b"
    ],
    "member_categories": [
     "emotional_state"
    ],
    "support_ratio": 1.0,
    "standing": "unanimous",
    "registers": [
     "everyday_cultural"
    ]
   },
   {
    "cluster_id": "C2",
    "label": "heartbreak",
    "category": "emotional_state",
    "member_sense_ids": [
     "S4"